Song,Film/Album,Artists
Meri Sanson Mein Tum,Aaina,"Asha Bhosle, Kumar Sanu"
Na Bolo Na Kichhu Bolo Na,1942 A Love Story,Lata Mangeshkar
Aankhon Aankhon Mein Baat Hone Do,Aankhon Aankhon Mein,"Kishore Kumar, Asha Bhosle"
"O Prajapati, Prajapati",A Legend Of Glory,Lata Mangeshkar
Zameen Se Humen Aasman Par,Adalat,"Asha Bhosle, Mohammed Rafi"
"Priyotamo , Ki Likhi Tomay",A Legend Of Glory,Lata Mangeshkar
Khatouba,Alibaba Aur 40 Chor,Asha Bhosle
Banshi Keno Hai,Aamaar Priyo Gaan,Lata Mangeshkar
Raat Ke Hamsafar,An Evening In Paris,"Asha Bhosle, Mohammed Rafi"
Ami Cholte Cholte Theme Gechhi,Abaak Rater Tara,Lata Mangeshkar
Zuby Zuby Jalembu,An Evening In Paris,Asha Bhosle
Bhulo Na Pratham Se Din,Abaak Rater Tara,Lata Mangeshkar
Aaj Ki Raat Koi Aane Ko Hai,Anamika,Asha Bhosle
Dharanir Pathe Pathe,Abaak Rater Tara,Lata Mangeshkar
Logo Na Maro Ise,Anamika,Asha Bhosle
Ei Jiban,Abaak Rater Tara,Lata Mangeshkar
Sara Pyar Tumhara,Anand Ashram,"Asha Bhosle, Kishore Kumar"
O Amar Pran Sajani,Abaak Rater Tara,Lata Mangeshkar
Dil Use Do Jo Jaan De De,Andaz,"Mohammed Rafi, Asha Bhosle"
Saat Sakaale,Abaak Rater Tara,Lata Mangeshkar
Roz Roz Dali Dali,Angoor,Asha Bhosle
Sabar Aarale,Abaak Rater Tara,Lata Mangeshkar
Hungama Ho Gaya,Anhonee,Asha Bhosle
Bojho Na Keno Je,Adwitiya,Lata Mangeshkar
Duniya Mein Logon Ko,Apna Desh,"Asha Bhosle, R.D. Burman"
Chanchal Mon Anmona Hoy,Adwitiya,Hemanta Mukherjee
Tum Mile Pyar Se,Apradh,"Kishore Kumar, Asha Bhosle"
Chanchal Moyuri E Raat,Adwitiya,Lata Mangeshkar
Gun Guna Rahe Hai Bhanvare,Aradhana,"Asha Bhosle, Mohammed Rafi"
Jabar Bela Pichhu Theke,Adwitiya,Lata Mangeshkar
Thodasa Pagla,Aur Pyar Ho Gaya,Asha Bhosle
Mon Lage Na,All Time Greats,Lata Mangeshkar
Piya Piya Piya Mora Jiya Pukare,Baap Re Baap,"Asha Bhosle, Kishore Kumar"
Padmapatay Bhorer Shisir,All Time Greats,Lata Mangeshkar
Sare Shaher Men Aap Sa Koi Nahin,Bairaag,"Asha Bhosle, Mohammed Rafi"
Runner,All Time Greats,Lata Mangeshkar
Na To Caravan Ki Talash Hai,Barsaat Ki Raat,"Mohammed Rafi, Manna Dey, Asha Bhosle, Sudha Malhotra, S.D.Batish"
Tomar Bakulbone,All Time Greats,Lata Mangeshkar
Na Bole Tum Na Maine Kuchh Kaha,Baton Baton Mein,"Asha Bhosle, Amit Kumar"
Suniye Kahiye Kahiye,Baton Baton Mein,"Kishore Kumar, Asha Bhosle"
Aa Khel Khelen Hum,Bekhudi,"Asha Bhosle, Kumar Sanu, Kishore Kumar"
Dekh Ke Yeh Roomal,Bekhudi,"Asha Bhosle, Kumar Sanu"
Khat Maine Tere Naam Likha,Bekhudi,"Asha Bhosle, Kumar Sanu"
Sare Jahan Se Achha,Bhai Bahen,Asha Bhosle
Diwana Mastana Hua Dil,Bombai Ka Babu,"Mohammed Rafi, Asha Bhosle, Kishore Kumar"
Bhali Bhali Si Ek Surat,Buddha Mil Gaya,"Asha Bhosle, Kishore Kumar"
Kaho Kahan Chale,Bulundi,"Kishore Kumar, Asha Bhosle"
Leke Pahla Pahla Pyar,C.I.D.,Mohammed Rafi
Ab Jo Mile Hai To,Caravan,Asha Bhosle
Daiya Yeh Main Kahan Phasi,Caravan,Asha Bhosle
Goriya Kahan Tera Des Re,Caravan,"Mohammed Rafi, Asha Bhosle"
Piya Tu Ab To Aaja,Caravan,"Asha Bhosle, R.D. Burman"
Haal Kaisa Hai Janab Ka,Chalti Ka Naam Gaadi,"Asha Bhosle, Kishore Kumar"
Main Sitaron Ka Tarana,Chalti Ka Naam Gaadi,"Kishore Kumar, Asha Bhosle"
Parbat Se Kali Ghata Takraee,Chandni,"Asha Bhosle, Vinod Rathod"
Jaaneman Jaaneman Tere Do Nain,Chhoti Si Baat,"Asha Bhosle, Yesudas"
Le Jayenge Le Jayenge,Chor Machaye Shor,"Kishore Kumar, Asha Bhosle"
Pyar Ka Dard Hai,Dard,"Kishore Kumar, Asha Bhosle"
Jeena Kya Aji Pyar Bina,Dhan Daulat,"Kishore Kumar, Asha Bhosle"
Haye Re Haye Tera Ghunghta,Dhongee,"Asha Bhosle, Kishore Kumar"
Yeh Raaten Yeh Mausam,Dilli Ka Thug,"Kishore Kumar, Asha Bhosle"
Zara Sa Jhoom Loon Main,Dilwale Dulhania Le Jayenge,"Asha Bhosle, Abhijeet"
Jab Chali Thandi Hawa,Do Badan,Asha Bhosle
Yeh Mera Dil Yaar Ka Diwana,Don,Asha Bhosle
Dooriyan Nazdikiyan Ban Gayi,Duniya,"Kishore Kumar, Asha Bhosle"
Aap Yun Hi Agar Humse Milte Rahe,Ek Musafir Ek Hasina,"Asha Bhosle, Mohammed Rafi"
Bahut Shukriya Badi Meherbani,Ek Musafir Ek Hasina,"Asha Bhosle, Mohammed Rafi"
Main Pyar Ka Rahi Hoon,Ek Musafir Ek Hasina,"Asha Bhosle, Mohammed Rafi"
Parda Hata Do,Ek Phool Do Mali,"Asha Bhosle, Mohammed Rafi"
Teri Mehfil Mein,Ek Teri Nishani,Asha Bhosle
Yeh Lamha Jee Lene De,Filhaal,Asha Bhosle
Geet Gaaya Patharon Ne,Geet Gaaya Patharon Ne,"Asha Bhosle, Mahendra Kapoor"
Botal Se Ik Baat Chali,Ghar,"Asha Bhosle, Mohammed Rafi"
Aana Re Aana Re,Gurudev,Asha Bhosle
Halle Halle,Gurudev,"Asha Bhosle, Shailendra Singh"
Dum Maro Dum,Hare Rama Hare Krishna,Asha Bhosle
Ek Paheli Hai Tu,Heera Panna,"Kishore Kumar, Asha Bhosle"
Ladki Nahin Tu Lakdi Ka Khamba Hai,Himmatwala,"Kishore Kumar, Asha Bhosle"
Taki Oh Taki,Himmatwala,"Kishore Kumar, Asha Bhosle"
Aaiye Meharban,Howrah Bridge,Asha Bhosle
Abhi Na Jao Chhod Kar,Hum Dono,"Asha Bhosle, Mohammed Rafi"
Jahan Mein Aesa Kaun Hai,Hum Dono,Asha Bhosle
Hum Kisi Se Kum Nahin,Hum Kisi Se Kum Nahin,"Mohammed Rafi, Asha Bhosle"
Humko To Yara Hai Teri Yari,Hum Kisi Se Kum Nahin,"Kishore Kumar, Asha Bhosle"
Mil Gaya Humko Saathi Mil Gaya,Hum Kisi Se Kum Nahin,"Asha Bhosle, Kishore Kumar"
Ye Ladka Hay Allah Kaisa Hai Diwana,Hum Kisi Se Kum Nahin,"Asha Bhosle, Mohammed Rafi"
Woh Haseen Dard De Do,Hum Saya,Asha Bhosle
Hum Tum Gumsum Raat,Hum Shakal,"Kishore Kumar, Asha Bhosle"
Dhal Gaya Din Ho Gayi Sham,Humjoli,"Asha Bhosle, Mohammed Rafi"
Chhoti Si Kahani Se,Ijaazat,Asha Bhosle
Katra Katra,Ijaazat,Asha Bhosle
Khali Hath Sham Aai Hai,Ijaazat,Asha Bhosle
Mera Kuchh Samaan,Ijaazat,Asha Bhosle
Aur Is Dil Mein,Imaandaar,"Asha Bhosle, Suresh Wadkar"
Tere Haathon Mein,Jaani Dushman,"Mohammed Rafi, Asha Bhosle"
Baithe Hai Kya Uske Paas,Jewel Thief,Asha Bhosle
Raat Akeli Hai Bujh Gaye Die,Jewel Thief,Asha Bhosle
Barah Baje Ki Suiyon Jaise,Jhoota Kahin Ka,"Kishore Kumar, Asha Bhosle"
Jeevan Ke Har Mod Pe Mil Jayenge,Jhoota Kahin Ka,"Kishore Kumar, Asha Bhosle"
Tora Man Darpan Kahlaye,Kaajal,Asha Bhosle
Koi Aaya Aane Bhi De,Kaala Sona,Asha Bhosle
Sun Sun Qasam Se,Kaala Sona,"Asha Bhosle, Danny Denzongpa"
Janeman Janeman,Kaho Naa....Pyar Hai,Asha Bhosle
Aap Yahan Aaye Kisliye,Kal Aaj Aur Kal,"Asha Bhosle, Shamshad Begum, Kishore Kumar"
Hum Jab Honge Saath Saal Ke,Kal Aaj Aur Kal,"Kishore Kumar, Asha Bhosle"
Hamare Khwabon Ke,Kal Ki Awaz,Asha Bhosle
Tumhari Nazron Mein Humne Dekha,Kal Ki Awaz,"Asha Bhosle, Kumar Sanu"
Achha Ji Main Haari Chalo,Kala Pani,"Asha Bhosle, Mohammed Rafi"
Ek Hasina Thi Ek Diwana Tha,Karz,"Kishore Kumar, Asha Bhosle"
Diwana Hua Badal,Kashmir Ki Kali,"Asha Bhosle, Mohammed Rafi"
Isharon Isharon Men Dil Lenewale,Kashmir Ki Kali,"Asha Bhosle, Mohammed Rafi"
Meri Jaan Balle Balle,Kashmir Ki Kali,"Asha Bhosle, Mohammed Rafi"
Phir Thes Lagi Dil Ko,Kashmir Ki Kali,Asha Bhosle
Mera Naam Hai Shabnam,Kati Patang,"Asha Bhosle, R.D. Burman"
Ae Lo Pyar Ke Din Aaye,Khel Khel Mein,"Asha Bhosle, Kishore Kumar"
Ek Main Aur Ek Tu,Khel Khel Mein,"Asha Bhosle, Kishore Kumar"
Khullam Khulla Pyar Karenge,Khel Khel Mein,"Asha Bhosle, Kishore Kumar"
Sapna Mera Toot Gaya,Khel Khel Mein,"Asha Bhosle, R.D. Burman"
Piya Bawri Piya Bawri,Khubsoorat,"Asha Bhosle, Ashok Kumar"
Sun Sun Sun Didi,Khubsoorat,Asha Bhosle
Bechara Dil Kya Kare,Khushboo,Asha Bhosle
Ghar Jayegi Tar Jayegi,Khushboo,Asha Bhosle
Aao Huzoor Tumko,Kismet,Asha Bhosle
Kajra Mohabbat Wala,Kismet,"Asha Bhosle, Shamshad Begum"
Kab Ke Bichhde Hue,Laawaris,"Asha Bhosle, Kishore Kumar"
Koi Aaya Dhadkan Kahti Hai,Lajwanti,Asha Bhosle
Koi Shahari Babu,Loafer,Asha Bhosle
Motiyon Ki Ladi Hoon Main,Loafer,Asha Bhosle
Jab Chhaye Mera Jadoo,Lootmaar,Asha Bhosle
Kya Ghazab Karte Ho Ji,Love Story,Asha Bhosle
Ye Ladki Zarasi Diwani Lagti Hai,Love Story,"Asha Bhosle, Amit Kumar"
Ankhon Ankhon Mein,Mahal,"Asha Bhosle, Kishore Kumar"
Yeh Duniyawale Poochhenge,Mahal,"Asha Bhosle, Kishore Kumar"
Chhap Tilak Sab Chhini Re,Main Tulsi Tere Aangan Ki,"Lata Mangeshkar, Asha Bhosle"
Chori Chori Solah Singar Karoongi,Manoranjan,Asha Bhosle
Ang Lag Ja Balma,Mera Naam Joker,Asha Bhosle
Teetar Ke Do Aage Teetar,Mera Naam Joker,"Asha Bhosle, Simi, Mukesh"
Jhoomka Gira Re,Mera Saaya,Asha Bhosle
Aao Na Gale Lag Jao Na,Mere Jeevan Saathi,Asha Bhosle
Jaiye Aap Kahan Jayenge,Mere Sanam,Asha Bhosle
Yeh Hai Reshmi Zulfon Ka Andhera,Mere Sanam,Asha Bhosle
Tauba Tauba Kya Hoga,Mr.Natwarlal,Asha Bhosle
Pyar Zindagi Hai,Muqaddar Ka Sikandar,Lata Mangeshkar
Aaj Rapat Jaayen To,Namak Halaal,"Kishore Kumar, Asha Bhosle"
Jawani Jan-E-Man,Namak Halaal,Asha Bhosle
Raat Baaqi Baat Baaqi,Namak Halaal,"Asha Bhosle, Shashi"
Phir Se Aaiyo Badra Bidesi,Namkeen,Asha Bhosle
Ankhon Mein Kya Ji,Nau Do Gyarah,"Kishore Kumar, Asha Bhosle"
Pallu Latke,Nauker,"Asha Bhosle, Kishore Kumar"
Ambe Tu Hai Jagdambe Kali,Navaratri,"Mohammed Rafi, Asha Bhosle"
Are Ja Re Hat Natkhat,Navrang,"Asha Bhosle, Mahendra Kapoor"
Mang Ke Saath Tumhara,Naya Daur,"Mohammed Rafi, Asha Bhosle"
Reshmi Salwar Kurta Jali Ka,Naya Daur,"Asha Bhosle, Shamshad Begum"
Uden Jab Jab Zulfen Teri,Naya Daur,"Mohammed Rafi, Asha Bhosle"
Main Chali Main Chali,Padosan,"Lata Mangeshkar, Asha Bhosle"
Sa Re Ke Sa Re,Parichay,"Asha Bhosle, Kishore Kumar"
Thande Thande Paani Se Nahana,Pati Patni Aur Woh,Asha Bhosle
Chhod Do Aanchal Zamana Kya Kahega,Paying Guest,"Kishore Kumar, Asha Bhosle"
O Nigahe Mastana,Paying Guest,"Kishore Kumar, Asha Bhosle"
Ek Pardesi Mera Dil Le Gaya,Phagun,"Asha Bhosle, Mohammed Rafi"
Ankhon Se Jo Utri Hai Dil Men,Phir Wohi Dil Laya Hoon,Asha Bhosle
Hamdam Mere,Phir Wohi Dil Laya Hoon,"Mohammed Rafi, Asha Bhosle"
Chain Se Hamko Kabhi,Pran Jaye Par Vachan,"Na Jaye, Asha Bhosle"
Kisi Pe Dil Agar Aa Jaye To,Rafoo Chakkar,"Asha Bhosle, Shailendra Singh"
Aasman Se Ek Sitara,Rahi Badal Gaye,"Asha Bhosle, R.D. Burman"
Jab Andhera Hota Hai,Raja Rani,"Asha Bhosle, Bhupinder Singh"
Bhagi Re Bhagi Brij Bala,Rajput,"Asha Bhosle, Mahendra, Kapoor, Manhar Udhas, Dilraj Kaur"
Yaar Ki Khabar Mil Gai,Ram Balram,"Asha Bhosle, Kishore Kumar"
Sajna Hai Mujhe Sajna Ke Liye,Saudagar,Asha Bhosle
O Sathi Chal,Seeta Aur Geeta,"Asha Bhosle, Kishore Kumar"
Intaha Ho Gai Intezar Ki,Sharaabi,"Kishore Kumar, Asha Bhosle"
Inteha Ho Gai,Sharaabi,"Kishore Kumar, Asha Bhosle"
Mujhe Naulakha Mangawa De Re,Sharaabi,"Asha Bhosle, Kishore Kumar"
Neend Churake Raaton Mein,Shareef Badmaash,"Asha Bhosle, Kishore Kumar"
Reshmi Ujala Hai Makhmali Andhera,Sharmilee,Asha Bhosle
Parde Mein Rahne Do,Shikar,Asha Bhosle
Mud Mud Ke Na Dekh Mud Mud Ke,,"Asha Bhosle, Manna Dey"
Mud Mud Ke Na Dekh Mud Mud Ke,Shree 420,"Asha Bhosle, Manna Dey"
Mausam Pyar Ka,Sitamgar,"Asha Bhosle, Kishore Kumar"
Yeh Saye Hain Yeh Duniya Hai,Sitara,Asha Bhosle
Ae Yaar Sun Yaari Teri,Suhaag,Mohammed Rafi
Main To Beghar Hoon,Suhaag,"Asha Bhosle, Shashi Kapoor"
Teri Rab Ne Bana Di Jodi,Suhaag,"Asha Bhosle, Mohammed"
Are Yaar Meri Tum Bhi Ho Ghazab,Teen Devian,"Kishore Kumar, Asha Bhosle"
Paan Khaye Saiyan Hamarao,Teesri Kasam,Asha Bhosle
Aaja Aaja Main Hoon Pyar Tera,Teesri Manzil,"Asha Bhosle, Mohammed Rafi"
O Haseena Zulfonwale Jane Jahan,Teesri Manzil,"Asha Bhosle, Mohammed Rafi"
O Mere Sona Re Sona,Teesri Manzil,"Asha Bhosle, Mohammed Rafi"
Mujhe Rang De,Thakshak,Asha Bhosle
Pal Do Pal Ka Saath Humara,The Burning Train,"Mohammed Rafi, Asha Bhosle"
Do Lafzon Ki Hai Dil Ki Kahani,The Great Gambler,"Asha Bhosle, Amitabh, Bachchan, Sharad Kumar"
O Diwanon Dil Sambhalo,The Great Gambler,Asha Bhosle
Pahle Pahle Pyar Ki Mulaqaten,Tumsa Nahin Dekha,"Asha Bhosle, Mohammed Rafi"
Pahle Pahle Pyar Ki Mulaqaten,The Great Gambler,"Kishore Kumar, Asha Bhosle"
Sar Par Topi Lal,Tumsa Nahin Dekha,"Asha Bhosle, Mohammed Rafi"
Dil Cheez Kya Hai,Umrao Jaan,Asha Bhosle
In Ankhon Ki Masti,Umrao Jaan,Asha Bhosle
Justuju Jiski Thi,Umrao Jaan,Asha Bhosle
Yeh Kya Jagah Hai Doston,Umrao Jaan,Asha Bhosle
Chanda Mama Door Ke,Vachan,Asha Bhosle
Udi Baba,Vidhaata,Asha Bhosle
Aage Bhi Jane Na Tu,Waqt,Asha Bhosle
Din Hai Bahar Ke,Waqt,"Asha Bhosle, Mahendra Kapoor"
Shokh Nazar Ki Bijliyan,Woh Kaun Thi,Asha Bhosle
Aap Ke Kamre Mein,Yaadon Ki Baaraat,"Asha Bhosle, Kishore Kumar"
Chura Liya Hai Tumne Jo Dil Ko,Yaadon Ki Baaraat,"Asha Bhosle, Mohammed Rafi"
Lekar Hum Diwana Dil,Yaadon Ki Baaraat,"Asha Bhosle, Kishore Kumar"
O Meri Soni Meri Tamanna,Yaadon Ki Baaraat,"Asha Bhosle, Kishore Kumar"
Kitni Haseen Hain Nasheeli,Yeh Nazdeekiyan,Asha Bhosle
Yehi Woh Jaga Hai Yehi Woh Fazayen,Yeh Raat Phir Na Aayegi,Asha Bhosle
Jalta Hai Jiya Mera,Zakhmee,"Kishore Kumar, Asha Bhosle"
Tum Bhi Chalo Hum Bhi Chale,Zameer,"Kishore Kumar, Asha Bhosle"
