Song,Film/Album,Artists
E Shahar Pranta,Aami Aar Mor Chhaayaa,Bhupen Hazarika
Ami Ek Jajabar,All Time Greats,Bhupen Hazarika
Bistirna Dupare,All Time Greats,Bhupen Hazarika
Ganga Amar Ma,All Time Greats,Bhupen Hazarika
Gum Gum Gum Gum,All Time Greats,Bhupen Hazarika
Hey Dola Hey Dola,All Time Greats,Bhupen Hazarika
O Bideshi Bandhu,All Time Greats,Bhupen Hazarika
Samayer Agragatir,All Time Greats,Bhupen Hazarika
Aaj Jiban Khunje Pabi,Ami Ak Jajabar,Bhupen Hazarika
Manush Manusher Jannya,Ami Ak Jajabar,Bhupen Hazarika
Sagar Sangame,Ami Ak Jajabar,Bhupen Hazarika
Agun Jharchhe Kabitar Sangsare,Amra Korbo Joy,Bhupen Hazarika
E Kon Bharatbarshe Amra Achhi,Amra Korbo Joy,Bhupen Hazarika
Ei Prithibi Ek Krirangan,Amra Korbo Joy,Bhupen Hazarika
Shesh Kabider Jatra,Amra Korbo Joy,Bhupen Hazarika
O Malik Sara Jiban Kandale,Bani Jetha Chiradin Rabe,Bhupen Hazarika
Chirauchhal Dheu Tule,Bengali Modern Songs,Bhupen Hazarika
Jodi Jiban Kande Nai Nai Boli,Bengali Modern Songs,Bhupen Hazarika
Mithe Mithe Phaguner,Bengali Modern Songs,Bhupen Hazarika
Rum Jhum Nupur Bajay,Bengali Modern Songs,Bhupen Hazarika
Amra Korbo Joy,Bengali Modern Songs,"Bhupen Hazarika, Chorus"
Bahudiner Agete Godhulir Belate,Bengali Modern Songs,Bhupen Hazarika
Krishnakaya Afrika Mor,Bengali Modern Songs,Bhupen Hazarika
London Jabo Haowai Garite,Bengali Modern Songs,Bhupen Hazarika
Pathe Namo Aloker Sena,Bengali Modern Songs,Bhupen Hazarika
Thik Godhulite,Bengali Modern Songs,Bhupen Hazarika
Thik Godhulite,Bengali Puja Hits,Bhupen Hazarika
Prem Ke Kabhu Swarga Bala Jay Na,Bengali Puja Hits,Bhupen Hazarika
Prem Ke Kabhu Swarga Bala Jay Na,,"Bhupen Hazarika, Chorus"
Bharateri Matir Ghare Bajuk,Bengali Songs,Bhupen Hazarika
Dipali Shefali Anjalire,Bengali Songs,Bhupen Hazarika
Hridayer Byatha Biraher Katha,Bengali Songs,Bhupen Hazarika
Shaishabete Khealite Tomar,Bengali Songs,Bhupen Hazarika
Amay Ekjan Sada Manus Dao,Bengali Songs,Bhupen Hazarika
Bahudiner Basana O Aalta,Bengali Songs,Bhupen Hazarika
Behula Bangla,Bengali Songs,Bhupen Hazarika
Ektu Gelei Athoi Sagar,Bengali Songs,Bhupen Hazarika
O Bidhi Amay Kalo Korle Jodi,Bengali Songs,Bhupen Hazarika
Sabar Hridaye Rabindranath,Bengali Songs,Bhupen Hazarika
Shimul Ranga Palash Ranga,Bengali Songs,Bhupen Hazarika
Shiter Shishir Bheja Raat,Bengali Songs,Bhupen Hazarika
Agun Jwele Dui Chokhete,Bhupen Hazarika Aami,Bhupen Hazarika
Ami Aschhi,Bhupen Hazarika Aami,Bhupen Hazarika
Ke Bale Amare,Bhupen Hazarika Aami,Bhupen Hazarika
O Kashbon,Bhupen Hazarika Aami,"Bhupen Hazarika, Chorus, Aar Mor Bengali"
Smritir Baluchare,Bhupen Hazarika Aami,Bhupen Hazarika
Sharatbabu Khola Chithi Dilam,Bhupen Hazarika Ami,Bhupen Hazarika
Bhojbaji,Bhupen Hazarika,Bhupen Hazarika
Dhak Dhak Dhak Dhak,Bhupen Hazarika,Bhupen Hazarika
Ki Je Sukher Lagi,Bhupen Hazarika,Bhupen Hazarika
Madarer Phul Kono Pujate Na Lage,Bhupen Hazarika,Bhupen Hazarika
Ujan Tane Aase,Bhupen Hazarika,Bhupen Hazarika
Janakpurer Janaki Je,Bhupen Hazarika Aami,Bhupen Hazarika
Agun Bhebe Jare Kachhe Dakini,Bhupen Hazarika Ami,Bhupen Hazarika
Ekhane Bristi Mukhar,Bhupen Hazarika Ami,Bhupen Hazarika
Ekti Rangin Chadar,Bhupen Hazarika Ami,Bhupen Hazarika
Jibanta Jodi Abhinoy Hoy,Bhupen Hazarika Ami,Bhupen Hazarika
Manashi Biday,Bhupen Hazarika Ami,Bhupen Hazarika
Raatri Tomar Naam,Bhupen Hazarika Ami,Bhupen Hazarika
Aay Kabita Aay,Bindute Sindhu,Bhupen Hazarika
Ateeter Itihaase,Bindute Sindhu,Bhupen Hazarika
Bharaa Bhadarer Baane,Bindute Sindhu,Bhupen Hazarika
Jhik Mik Deyalir,Bindute Sindhu,Bhupen Hazarika
Jiban Sindhu,Bindute Sindhu,Bhupen Hazarika
O Maa Jashoda,Bindute Sindhu,Bhupen Hazarika
O Tui Abujh Mon,Bindute Sindhu,Bhupen Hazarika
Bashikaran Kajol Chokhe,Chameli Mem Saheb,Bhupen Hazarika
Aare Bandhure Kajol,Dui Bechara,Bhupen Hazarika
Kalir Krishna Bole Deko Na,Ek Khanda Megh Bhese,Bhupen Hazarika
Majh Raate Mor Andhar Ghare,Ek Khanda Megh Bhese,Bhupen Hazarika
Prem Amar Shata Srabaner,Ek Khanda Megh Bhese,Bhupen Hazarika
Sabuj Prantare,Ek Khanda Megh Bhese,Bhupen Hazarika
Sajani Sajani,Ek Khanda Megh Bhese,Bhupen Hazarika
Ekkhana Megh Bhese Elo Akashe,Ek Sathe,Bhupen Hazarika
Rangila Nao Re Amar,Gaan Shudhu Gaan,Bhupen Hazarika
Aay Aay Chhute Aay,Hits Of Bhupen Hazarika,Bhupen Hazarika
Akashi Ganga,Hits Of Bhupen Hazarika,Bhupen Hazarika
Bhang Bhang Bhangre Pathar Bhang,Hits Of Bhupen Hazarika,Bhupen Hazarika
Haripada Kerani,Hits Of Bhupen Hazarika,Bhupen Hazarika
Ibar Dibo Dalan Kotha,Hits Of Bhupen Hazarika,Bhupen Hazarika
Prabhati Pakhira Keno Gaay,Hits Of Bhupen Hazarika,Bhupen Hazarika
Pratham Na Hoy Dwitiya Na Hoy,Hits Of Bhupen Hazarika,Bhupen Hazarika
Pratidhwani Suni,Hits Of Bhupen Hazarika,Bhupen Hazarika
Sahasra Jane More Prashna Kare,Hits Of Bhupen Hazarika,Bhupen Hazarika
Shital Shital Jochhna Raate,Hits Of Bhupen Hazarika,Bhupen Hazarika
Shyam Kanu Satyor Maron Nai,Hits Of Bhupen Hazarika,Bhupen Hazarika
Tomar Chhonwa Komal Keya,Hits Of Bhupen Hazarika,Bhupen Hazarika
Tumi Amar Kalpanari,Hits Of Bhupen Hazarika,Bhupen Hazarika
Tumi Natun Purush,Hits Of Bhupen Hazarika,Bhupen Hazarika
Kakhono To Hoi Nai Klanta,Jeeban Trishna,Bhupen Hazarika
Rim Jhim Rim Jhimm,Jibsndinga,Bhupen Hazarika
Chhariya Na Jasre,Mahut Bandhure,Bhupen Hazarika
Diganta Chhariye Tepantare,Mandella O Natun Gaan,Bhupen Hazarika
Ek Shankhachiler Sange Dilam,Mandella O Natun Gaan,Bhupen Hazarika
Jindabad Mandella,Mandella O Natun Gaan,Bhupen Hazarika
Oi Shona Jay,Mandella O Natun Gaan,Bhupen Hazarika
Swarger Kono Alada Thikana Nei,Mandella O Natun Gaan,Bhupen Hazarika
"Tumi, Amar Jemon",Mandella O Natun Gaan,Bhupen Hazarika
Ami Bhalobasi Manushke,Matite Janma Nilam,Bhupen Hazarika
Bajalire Banshiti,Mora Jatri Eki Taranir,Bhupen Hazarika
Ekti Kunri Duti Pata,Mora Jatri Eki Taranir,Bhupen Hazarika
Geile Ki Aasiben,Mora Jatri Eki Taranir,Bhupen Hazarika
Goom Goom Goom Goom,Mora Jatri Eki Taranir,Bhupen Hazarika
Mora Jatri Eki Taranir,Mora Jatri Eki Taranir,Bhupen Hazarika
Oi Kajal Kajal Dighi,Mora Jatri Eki Taranir,Bhupen Hazarika
Sajiye Dopati Mathar Khonpati,Mora Jatri Eki Taranir,Bhupen Hazarika
Su-Uchha Paharer Sringe,Mora Jatri Eki Taranir,"Bhupen Hazarika, Ruma Guhathakurata"
We Are On The Same Boat,Mora Jatri Eki Taranir,Bhupen Hazarika
Dham Dhama Dham Dham,Natun Diner Dak,Bhupen Hazarika
Kato Senanir Mrityu Holo,Natun Diner Dak,Bhupen Hazarika
Nadir Naam Bhalobasa,Natun Diner Dak,Bhupen Hazarika
Natun Diner Dak,Natun Diner Dak,Bhupen Hazarika
Nijhum Nishuti Shishirer Rat,Natun Diner Dak,Bhupen Hazarika
Chokh Chhal Chhal Kare,Sabar Hridaye Rabindranath,Bhupen Hazarika
Dante Kaitona Thot Aar,Sabar Hridaye Rabindranath,Bhupen Hazarika
Nana Barner Gabhire Bhai,Sabar Hridaye Rabindranath,Bhupen Hazarika
Dug Dug Dug Dug Dambaru,Sahasra Jane Morey,Bhupen Hazarika
E Kemon Ranga Jadu,Sahasra Jane Morey,Bhupen Hazarika
Ek Bnao Mele Na,Sahasra Jane Morey,Bhupen Hazarika
Goponey Goponey Kato Je,Sahasra Jone More Prashna,Bhupen Hazarika
Megh Tham Tham Kare,Shimana Periye,Bhupen Hazarika
Bandha Karo Ei Chhalona,Sopan,"Haimanti Sukla, Bhupen Hazarika"
Manabata,Sopan,Bhupen Hazarika
Teestar Paar Theke [1],Sopan,Bhupen Hazarika
Anka Banka E Pather,Sur Jetha Chiradin Rabe,"Hemanta Mukherjee, Bhupen"
Itihas Ami Itihas,Yubabarsher Gaan,Bhupen Hazarika
