Song,Film/Album,Artists
Ek Kanyake Dekhe To Lagchhe Emon,1942 A Love Story,Kumar Sanu
Mon Aaj Nirash To Noy,1942 A Love Story,Sivaji Chatterjee
Na Bolo Na Kichhu Bolo Na,1942 A Love Story,"Lata Mangeshkar, Kumar Sanu"
Raag Na Karo To Tomake Boli,1942 A Love Story,Kumar Sanu
Rimjhim Rimjhim,1942 A Love Story,"Kumar Sanu, Kavita Krishnamurthy"
Chokhe Chokhe Katha Balo,Aaj Dujane Romantic Hits,Asha Bhosle
Lakshmiti Dohai Tomar,Aaj Dujane Romantic Hits,Asha Bhosle
Na Ekhoni Noy Jabe,Aaj Dujane Romantic Hits,Asha Bhosle
Na Ekhoni Noy Jabe,,Asha Bhosle
Pora Banshi Shunle E Mon,Aaj Dujane Romantic Hits,Asha Bhosle
Sandhya Belay Tumi Ami,Aaj Dujane Romantic Hits,Asha Bhosle
Ei Edike Eso Esona,Aakashe Aaj Ranger Khela,Asha Bhosle
Ei Edike Eso Esona,,Asha Bhosle
Banshi Shune Ki,All Time Greats,Asha Bhosle
Jhum Jhum Jhum Raat Nijhum,All Time Greats,Asha Bhosle
Moyna Balo Tumi,All Time Greats,Asha Bhosle
Phire Elam,All Time Greats,"Asha Bhosle, R.D.Burman"
Se To Elo Na,All Time Greats,Kishore Kumar
Ekti Katha Aami Je Shudhu Jani,All Time Greats Asha Bhosle,Asha Bhosle
Ektu Aaro Noy Kachhe Thako Na,All Time Greats Asha Bhosle,"Asha Bhosle, R.D.Burman"
Hay Go Amar Mon Mane Na,All Time Greats Asha Bhosle,Asha Bhosle
Khub Chena Chena Mukhkhani,All Time Greats Asha Bhosle,Asha Bhosle
Na Na Na Na Parbo Na,All Time Greats Asha Bhosle,Asha Bhosle
Raat Dupure Kothay Jabe,All Time Greats Asha Bhosle,Asha Bhosle
Chhero Na Chhero Na Haath,Anyay Abichar,"Kishore Kumar, Sabina Yasmin"
Dekhle Kemon Tumi Khel,Anyay Abichar,"Kishore Kumar, Chorus"
Mon-Majhi Re,Anyay Abichar,R.D.Burman
Nagor Amar Kancha Peerit,Anyay Abichar,"Asha Bhosle, Shailendra Singh"
Rui Katla Ilish Bhebe,Anyay Abichar,Sabina Yasmin
Aar Ki Tomay Chharchhi,Aparupa,"Asha Bhosle, R.D.Burman"
Ami Jani Na,Aparupa,"Asha Bhosle, Abhijeet"
Angur Angur Chokh,Aparupa,Asha Bhosle
Pelam Tomay,Aparupa,"Amit Kumar, Arati Mukherjee"
Mohuay Jomechhe Aaj Mou Go,Asha Bhosle A Musical Journey,Asha Bhosle
Mohuay Jomechhe Aaj Mou Go,Asha Bhosle,Asha Bhosle
Aasbo Aar Ekdin Aaj Jai,Bani Jetha Chiradin Rabe,Asha Bhosle
Akash Keno Daake,Bedonar Baluchare,Kishore Kumar
Ek Din Pakhi Ure Jabe,Bedonar Baluchare,Kishore Kumar
Chande Jatra,Bengali Modern Song,Asha Bhosle
Tomar Je Oi Haater Mala,Bengali Modern Song Asha,Asha Bhosle
Phire Elam Dure Giye,Bengali Modern Songs,"Asha Bhosle, R.D.Burman"
Balo Ki Achhe Go,Best Of Rahul Deb Burman,R.D.Burman
Balo Ki Achhe Go,Aaj Dujane Romantic Hits,R.D.Burman
Deke Deke Kato,Best Of Rahul Deb Burman,R.D.Burman
Jani Na Kothay Tumi,Best Of Rahul Deb Burman,"Asha Bhosle, R.D.Burman"
Jete Jete Pathe Holo,Best Of Rahul Deb Burman,R.D.Burman
Kaal Kakhan Aasbe Balo Na,Best Of Rahul Deb Burman,R.D.Burman
Nadir Paare Uthchhe Dhonya,Best Of Rahul Deb Burman,R.D.Burman
Phire Eso Anuradha,Best Of Rahul Deb Burman,R.D.Burman
Shono Ei To Samay,Best Of Rahul Deb Burman,R.D.Burman
Shono Mon Boli Tomay,Best Of Rahul Deb Burman,R.D.Burman
Swapno Amar Hariye Gechhe,Best Of Rahul Deb Burman,R.D.Burman
Chhande Chhande Gaane Gaane,Chayanika Ragashrayee,Asha Bhosle
Darjeeling Jatra,Chhotoder Gaan,R.D.Burman
Emon Madhur Sandhyay,Ekanta Apan,Asha Bhosle
Hay Re Kala Eki Jwala,Ekanta Apan,Asha Bhosle
Khelbo Holi Rang Debo Na,Ekanta Apan,"Asha Bhosle, Kavita Krishnamurthy"
Na Na Na Kachhe Esona,Ekanta Apan,Asha Bhosle
Tolo Chhinnabeena,Ekanta Apan,Asha Bhosle
Tomari Chalar Pathe,Ekanta Apan,Asha Bhosle
Tomate Amate Dekha Hoyechhilo,Eki Sure Dui Gaan,R.D.Burman
Madhumas Jay,Pancham Tumi Kothay Asha,Kishore Kumar
Madhumas Jay,Aakashe Aaj Ranger Khela,"Amit Kumar, Arati Mukherjee"
Pran To Mane Na Go,Evergreen Hits Of,Amit Kumar
Tangra Tobu Katon Jay,Ga Pa Ga Re Sa,R.D.Burman
Ami Boli Tomay Dure Thako,Ki Likhi Tomai Priyotama,"Asha Bhosle, Lata Mangeshkar"
Aaj Dole Mon Kar Isharate,Kichhu Bali Gaane Gaane,Asha Bhosle
Bou Katha Kao,,Asha Bhosle
Bou Katha Kao,Kichhu Bali Gaane Gaane,Asha Bhosle
Durge Durge Durgatinashini,Kichhu Bali Gaane Gaane,"Asha Bhosle, Swapan Chakraborty"
Keu Jane Na Tumi Je Amar,Kichhu Bali Gaane Gaane,R.D.Burman
Ki Hobe Aar Purono Diner Katha,Kichhu Bali Gaane Gaane,R.D.Burman
Bhebechhi Bhule Jabo,Kotha Kotha Khunjechhi,Asha Bhosle
Ke Je Amar Ghum Bhangiye Gelo,Kotha Kotha Khunjechhi,Asha Bhosle
Kotha Kotha Khunjechhi Tomay,Kotha Kotha Khunjechhi,Asha Bhosle
Na Deko Na Deko Na Go More,Kotha Kotha Khunjechhi,Asha Bhosle
Rimi Jhimi Ei Srabane,Kotha Kotha Khunjechhi,Asha Bhosle
Tumi Kato Je Dure,Kotha Kotha Khunjechhi,"Asha Bhosle, R.D.Burman"
Tumi Jabe Go Chale Jabe Go,Legends Asha Bhosle,Asha Bhosle
Mone Pore Ruby Roy,Millennium,R.D.Burman
Jete Paro,Mone Pore Ruby Roy,Asha Bhosle
Jete Paro,Mone Pore Ruby Roy R D Burman And Asha Bhosle,Asha Bhosle
Ki Jadu Tomar Chokhe,Money Padey Ruby Roy,Asha Bhosle
Machher Kanta Khonpar Kanta,Money Padey Ruby Roy,Asha Bhosle
Age Ami Jodi Jantam,,Asha Bhosle
Age Ami Jodi Jantam,Pancham Tumi Kothay Asha,Asha Bhosle
Deke Deke Kato,,Asha Bhosle
Deke Deke Kato,Pancham Tumi Kothay Asha,Asha Bhosle
Jete Jete Pathe Holo Deri,Kichhu Bali Gaane Gaane,Asha Bhosle
Jete Jete Pathe Holo Deri,Pancham Tumi Kothay Asha,Asha Bhosle
Mone Pore Ruby Roy,Pancham Tumi Kothay Asha,Asha Bhosle
Phire Eso Anuradha,,Asha Bhosle
Phire Eso Anuradha,Pancham Tumi Kothay Asha,Asha Bhosle
Shono Ei To Samay,,Asha Bhosle
Shono Ei To Samay,Pancham Tumi Kothay Asha,Asha Bhosle
Shono Mon Boli Tomay,Pancham Tumi Kothay Asha,Asha Bhosle
Ekti Katha Hai Se Kailo Na,Phire Elam Asha Bhosle,Asha Bhosle
Jay Re Jay Re Bela Je Boye,Phire Eso Anuradha Rahul,"R.D.Burman, Asha Bhosle"
Chokhe Naame Brishti,Puja Hits Volume 84,Asha Bhosle
Akashe Surja Achhe Jatodin,Puja Hits Volume 84,Asha Bhosle
Ekta Deshlai Kathi Jwalao,Puja Hits Volume 84,Asha Bhosle
Dite Pari E Jiban,Purushottam,R.D.Burman
Aaj Gun Gun Gun Kunje Amar,Rajkumari,Asha Bhosle
Bandha Dwarer Andhakare,Rajkumari,"Kishore Kumar, Asha Bhosle"
E Ki Holo,Rajkumari,Kishore Kumar
Kato Naree Achhe E Gokule,Rajkumari,"Asha Bhosle, Kishore Kumar"
Ki Je Bhabi Elomelo,Rajkumari,Asha Bhosle
Tobu Bole Keno Sahasai,Pancham Tumi Kothay Asha,Kishore Kumar
Tobu Bole Keno Sahasai,Rajkumari,Kishore Kumar
Katha Diye Ele Na,,Asha Bhosle
Katha Diye Ele Na,Rd Xclusive Collection,Asha Bhosle
Baba O Khoka,Rd Xclusive Collection,Kishore Kumar
Jabo Ki Jabo Na,Rd Xclusive Collection,Asha Bhosle
Jete Dao Amay Dekona,Reshmi Churi Asha Bhosle,"R.D.Burman, Asha Bhosle"
Jete Dao Amay Dekona,Rd Xclusive Collection,Asha Bhosle
Ajar Baijan Ajar Baijan,Reshmi Churi Asha Bhosle,"R.D.Burman, Asha Bhosle"
Chaina Amar Reshmi Chudi,,Asha Bhosle
Chaina Amar Reshmi Chudi,Reshmi Churi Asha Bhosle,Asha Bhosle
E Jhumri Re - Cholechhi Eka,Sera Shilpi Sera Gaan,Kishore Kumar
Kine De Reshmi Churi,Serashilpi Seragaan,Asha Bhosle
Amar Malatilata Dole,Serashilpi Seragaan,Lata Mangeshkar
Phule Gandha Nei,Serashilpi Seragaan,Asha Bhosle
Chalo Chole Jai Haate Haat Rekhe,Sonar Juti Asha Bhosle And,"R.D.Burman, Asha Bhosle"
Dak Pathale Kaal Sakale,Sonar Juti Asha Bhosle And,"R.D.Burman, Asha Bhosle"
Ele Na Tumi Je,Sonar Juti Asha Bhosle And,R.D.Burman
Ki Kore Aasi Tomar Pashe,Sonar Juti Asha Bhosle And,Asha Bhosle
Aage Ami Jodi Jantam,Together Asha Bhosle And,R.D.Burman
"Sajani Go, Premer Katha",,R.D.Burman
"Sajani Go, Premer Katha",Together Asha Bhosle And,R.D.Burman
Tomar Katha Niye Ami,Together Asha Bhosle And,"Kishore Kumar, Asha Bhosle"
Tomar Katha Niye Ami,Tomar Katha Niye,R.D.Burman
